[
  {
    "schemaVersion": 1,
    "termId": "prep_baked",
    "taxonomyId": "preparation_technique",
    "origin": "base",
    "parentTermId": null,
    "i18n": {
      "it": {
        "label": "Al forno",
        "description": ""
      },
      "en": {
        "label": "Baked",
        "description": ""
      }
    },
    "aliases": {
      "it": [],
      "en": []
    },
    "legacyKeys": [
      "baked"
    ],
    "status": "active",
    "supersedesTermId": null,
    "provenance": {
      "sourceType": "system_seed",
      "sourceLabel": "V1 Data/UX Hardening Pass A",
      "reference": null,
      "rationale": "V1 canonical reference-data seed"
    },
    "searchTokens": [
      "prep",
      "baked",
      "al",
      "forno"
    ],
    "createdAt": "2026-09-04T09:00:00Z",
    "updatedAt": "2026-09-04T09:00:00Z"
  },
  {
    "schemaVersion": 1,
    "termId": "prep_roasted",
    "taxonomyId": "preparation_technique",
    "origin": "base",
    "parentTermId": null,
    "i18n": {
      "it": {
        "label": "Arrosto",
        "description": ""
      },
      "en": {
        "label": "Roasted",
        "description": ""
      }
    },
    "aliases": {
      "it": [],
      "en": []
    },
    "legacyKeys": [
      "roasted"
    ],
    "status": "active",
    "supersedesTermId": null,
    "provenance": {
      "sourceType": "system_seed",
      "sourceLabel": "V1 Data/UX Hardening Pass A",
      "reference": null,
      "rationale": "V1 canonical reference-data seed"
    },
    "searchTokens": [
      "prep",
      "roasted",
      "arrosto"
    ],
    "createdAt": "2026-09-04T09:00:00Z",
    "updatedAt": "2026-09-04T09:00:00Z"
  },
  {
    "schemaVersion": 1,
    "termId": "prep_grilled",
    "taxonomyId": "preparation_technique",
    "origin": "base",
    "parentTermId": null,
    "i18n": {
      "it": {
        "label": "Alla griglia",
        "description": ""
      },
      "en": {
        "label": "Grilled",
        "description": ""
      }
    },
    "aliases": {
      "it": [],
      "en": []
    },
    "legacyKeys": [
      "grilled"
    ],
    "status": "active",
    "supersedesTermId": null,
    "provenance": {
      "sourceType": "system_seed",
      "sourceLabel": "V1 Data/UX Hardening Pass A",
      "reference": null,
      "rationale": "V1 canonical reference-data seed"
    },
    "searchTokens": [
      "prep",
      "grilled",
      "alla",
      "griglia"
    ],
    "createdAt": "2026-09-04T09:00:00Z",
    "updatedAt": "2026-09-04T09:00:00Z"
  },
  {
    "schemaVersion": 1,
    "termId": "prep_pan_fried",
    "taxonomyId": "preparation_technique",
    "origin": "base",
    "parentTermId": null,
    "i18n": {
      "it": {
        "label": "In padella",
        "description": ""
      },
      "en": {
        "label": "Pan-fried",
        "description": ""
      }
    },
    "aliases": {
      "it": [],
      "en": []
    },
    "legacyKeys": [
      "pan_fried"
    ],
    "status": "active",
    "supersedesTermId": null,
    "provenance": {
      "sourceType": "system_seed",
      "sourceLabel": "V1 Data/UX Hardening Pass A",
      "reference": null,
      "rationale": "V1 canonical reference-data seed"
    },
    "searchTokens": [
      "prep",
      "pan",
      "fried",
      "in",
      "padella"
    ],
    "createdAt": "2026-09-04T09:00:00Z",
    "updatedAt": "2026-09-04T09:00:00Z"
  }
]
