[
  {
    "schemaVersion": 1,
    "termId": "food_group_grains",
    "taxonomyId": "food_category",
    "origin": "base",
    "parentTermId": null,
    "i18n": {
      "it": {
        "label": "Cereali in chicco",
        "description": ""
      },
      "en": {
        "label": "Whole grains",
        "description": ""
      }
    },
    "aliases": {
      "it": [],
      "en": []
    },
    "legacyKeys": [
      "grains"
    ],
    "status": "active",
    "supersedesTermId": null,
    "provenance": {
      "sourceType": "system_seed",
      "sourceLabel": "V1 Data/UX Hardening Pass A",
      "reference": null,
      "rationale": "V1 canonical reference-data seed"
    },
    "searchTokens": [
      "food",
      "group",
      "grains",
      "cereali",
      "in",
      "chicco",
      "whole"
    ],
    "createdAt": "2026-09-04T09:00:00Z",
    "updatedAt": "2026-09-04T09:00:00Z"
  },
  {
    "schemaVersion": 1,
    "termId": "food_group_bread_bakery",
    "taxonomyId": "food_category",
    "origin": "base",
    "parentTermId": null,
    "i18n": {
      "it": {
        "label": "Pane e prodotti da forno",
        "description": ""
      },
      "en": {
        "label": "Bread and bakery",
        "description": ""
      }
    },
    "aliases": {
      "it": [],
      "en": []
    },
    "legacyKeys": [
      "bread_bakery"
    ],
    "status": "active",
    "supersedesTermId": null,
    "provenance": {
      "sourceType": "system_seed",
      "sourceLabel": "V1 Data/UX Hardening Pass A",
      "reference": null,
      "rationale": "V1 canonical reference-data seed"
    },
    "searchTokens": [
      "food",
      "group",
      "bread",
      "bakery",
      "pane",
      "e",
      "prodotti",
      "da",
      "forno",
      "and"
    ],
    "createdAt": "2026-09-04T09:00:00Z",
    "updatedAt": "2026-09-04T09:00:00Z"
  },
  {
    "schemaVersion": 1,
    "termId": "food_group_pasta_rice_cereals",
    "taxonomyId": "food_category",
    "origin": "base",
    "parentTermId": null,
    "i18n": {
      "it": {
        "label": "Pasta, riso e cereali",
        "description": ""
      },
      "en": {
        "label": "Pasta, rice and cereals",
        "description": ""
      }
    },
    "aliases": {
      "it": [],
      "en": []
    },
    "legacyKeys": [
      "pasta_rice_cereals"
    ],
    "status": "active",
    "supersedesTermId": null,
    "provenance": {
      "sourceType": "system_seed",
      "sourceLabel": "V1 Data/UX Hardening Pass A",
      "reference": null,
      "rationale": "V1 canonical reference-data seed"
    },
    "searchTokens": [
      "food",
      "group",
      "pasta",
      "rice",
      "cereals",
      "riso",
      "e",
      "cereali",
      "and"
    ],
    "createdAt": "2026-09-04T09:00:00Z",
    "updatedAt": "2026-09-04T09:00:00Z"
  },
  {
    "schemaVersion": 1,
    "termId": "food_group_legumes",
    "taxonomyId": "food_category",
    "origin": "base",
    "parentTermId": null,
    "i18n": {
      "it": {
        "label": "Legumi",
        "description": ""
      },
      "en": {
        "label": "Legumes",
        "description": ""
      }
    },
    "aliases": {
      "it": [],
      "en": []
    },
    "legacyKeys": [
      "legumes"
    ],
    "status": "active",
    "supersedesTermId": null,
    "provenance": {
      "sourceType": "system_seed",
      "sourceLabel": "V1 Data/UX Hardening Pass A",
      "reference": null,
      "rationale": "V1 canonical reference-data seed"
    },
    "searchTokens": [
      "food",
      "group",
      "legumes",
      "legumi"
    ],
    "createdAt": "2026-09-04T09:00:00Z",
    "updatedAt": "2026-09-04T09:00:00Z"
  }
]
