[
  {
    "schemaVersion": 1,
    "termId": "food_group_cheese",
    "taxonomyId": "food_category",
    "origin": "base",
    "parentTermId": null,
    "i18n": {
      "it": {
        "label": "Formaggi",
        "description": ""
      },
      "en": {
        "label": "Cheese",
        "description": ""
      }
    },
    "aliases": {
      "it": [],
      "en": []
    },
    "legacyKeys": [
      "cheese"
    ],
    "status": "active",
    "supersedesTermId": null,
    "provenance": {
      "sourceType": "system_seed",
      "sourceLabel": "V1 Data/UX Hardening Pass A",
      "reference": null,
      "rationale": "V1 canonical reference-data seed"
    },
    "searchTokens": [
      "food",
      "group",
      "cheese",
      "formaggi"
    ],
    "createdAt": "2026-09-04T09:00:00Z",
    "updatedAt": "2026-09-04T09:00:00Z"
  },
  {
    "schemaVersion": 1,
    "termId": "food_group_plant_dairy_alternative",
    "taxonomyId": "food_category",
    "origin": "base",
    "parentTermId": null,
    "i18n": {
      "it": {
        "label": "Alternative vegetali ai latticini",
        "description": ""
      },
      "en": {
        "label": "Plant dairy alternatives",
        "description": ""
      }
    },
    "aliases": {
      "it": [],
      "en": []
    },
    "legacyKeys": [
      "plant_dairy_alternative"
    ],
    "status": "active",
    "supersedesTermId": null,
    "provenance": {
      "sourceType": "system_seed",
      "sourceLabel": "V1 Data/UX Hardening Pass A",
      "reference": null,
      "rationale": "V1 canonical reference-data seed"
    },
    "searchTokens": [
      "food",
      "group",
      "plant",
      "dairy",
      "alternative",
      "vegetali",
      "ai",
      "latticini",
      "alternatives"
    ],
    "createdAt": "2026-09-04T09:00:00Z",
    "updatedAt": "2026-09-04T09:00:00Z"
  },
  {
    "schemaVersion": 1,
    "termId": "food_group_fats_oils",
    "taxonomyId": "food_category",
    "origin": "base",
    "parentTermId": null,
    "i18n": {
      "it": {
        "label": "Grassi e oli",
        "description": ""
      },
      "en": {
        "label": "Fats and oils",
        "description": ""
      }
    },
    "aliases": {
      "it": [],
      "en": []
    },
    "legacyKeys": [
      "fats_oils"
    ],
    "status": "active",
    "supersedesTermId": null,
    "provenance": {
      "sourceType": "system_seed",
      "sourceLabel": "V1 Data/UX Hardening Pass A",
      "reference": null,
      "rationale": "V1 canonical reference-data seed"
    },
    "searchTokens": [
      "food",
      "group",
      "fats",
      "oils",
      "grassi",
      "e",
      "oli",
      "and"
    ],
    "createdAt": "2026-09-04T09:00:00Z",
    "updatedAt": "2026-09-04T09:00:00Z"
  },
  {
    "schemaVersion": 1,
    "termId": "food_group_sauces_condiments",
    "taxonomyId": "food_category",
    "origin": "base",
    "parentTermId": null,
    "i18n": {
      "it": {
        "label": "Salse e condimenti",
        "description": ""
      },
      "en": {
        "label": "Sauces and condiments",
        "description": ""
      }
    },
    "aliases": {
      "it": [],
      "en": []
    },
    "legacyKeys": [
      "sauces_condiments"
    ],
    "status": "active",
    "supersedesTermId": null,
    "provenance": {
      "sourceType": "system_seed",
      "sourceLabel": "V1 Data/UX Hardening Pass A",
      "reference": null,
      "rationale": "V1 canonical reference-data seed"
    },
    "searchTokens": [
      "food",
      "group",
      "sauces",
      "condiments",
      "salse",
      "e",
      "condimenti",
      "and"
    ],
    "createdAt": "2026-09-04T09:00:00Z",
    "updatedAt": "2026-09-04T09:00:00Z"
  }
]
