[
  {
    "schemaVersion": 1,
    "termId": "flavor_fresh",
    "taxonomyId": "flavor_profile",
    "origin": "base",
    "parentTermId": null,
    "i18n": {
      "it": {
        "label": "Fresco",
        "description": ""
      },
      "en": {
        "label": "Fresh",
        "description": ""
      }
    },
    "aliases": {
      "it": [],
      "en": []
    },
    "legacyKeys": [
      "fresh"
    ],
    "status": "active",
    "supersedesTermId": null,
    "provenance": {
      "sourceType": "system_seed",
      "sourceLabel": "V1 Data/UX Hardening Pass A",
      "reference": null,
      "rationale": "V1 canonical reference-data seed"
    },
    "searchTokens": [
      "flavor",
      "fresh",
      "fresco"
    ],
    "createdAt": "2026-09-04T09:00:00Z",
    "updatedAt": "2026-09-04T09:00:00Z"
  },
  {
    "schemaVersion": 1,
    "termId": "prep_raw",
    "taxonomyId": "preparation_technique",
    "origin": "base",
    "parentTermId": null,
    "i18n": {
      "it": {
        "label": "Crudo",
        "description": ""
      },
      "en": {
        "label": "Raw",
        "description": ""
      }
    },
    "aliases": {
      "it": [],
      "en": []
    },
    "legacyKeys": [
      "raw"
    ],
    "status": "active",
    "supersedesTermId": null,
    "provenance": {
      "sourceType": "system_seed",
      "sourceLabel": "V1 Data/UX Hardening Pass A",
      "reference": null,
      "rationale": "V1 canonical reference-data seed"
    },
    "searchTokens": [
      "prep",
      "raw",
      "crudo"
    ],
    "createdAt": "2026-09-04T09:00:00Z",
    "updatedAt": "2026-09-04T09:00:00Z"
  },
  {
    "schemaVersion": 1,
    "termId": "prep_boiled",
    "taxonomyId": "preparation_technique",
    "origin": "base",
    "parentTermId": null,
    "i18n": {
      "it": {
        "label": "Bollito",
        "description": ""
      },
      "en": {
        "label": "Boiled",
        "description": ""
      }
    },
    "aliases": {
      "it": [],
      "en": []
    },
    "legacyKeys": [
      "boiled"
    ],
    "status": "active",
    "supersedesTermId": null,
    "provenance": {
      "sourceType": "system_seed",
      "sourceLabel": "V1 Data/UX Hardening Pass A",
      "reference": null,
      "rationale": "V1 canonical reference-data seed"
    },
    "searchTokens": [
      "prep",
      "boiled",
      "bollito"
    ],
    "createdAt": "2026-09-04T09:00:00Z",
    "updatedAt": "2026-09-04T09:00:00Z"
  },
  {
    "schemaVersion": 1,
    "termId": "prep_steamed",
    "taxonomyId": "preparation_technique",
    "origin": "base",
    "parentTermId": null,
    "i18n": {
      "it": {
        "label": "Al vapore",
        "description": ""
      },
      "en": {
        "label": "Steamed",
        "description": ""
      }
    },
    "aliases": {
      "it": [],
      "en": []
    },
    "legacyKeys": [
      "steamed"
    ],
    "status": "active",
    "supersedesTermId": null,
    "provenance": {
      "sourceType": "system_seed",
      "sourceLabel": "V1 Data/UX Hardening Pass A",
      "reference": null,
      "rationale": "V1 canonical reference-data seed"
    },
    "searchTokens": [
      "prep",
      "steamed",
      "al",
      "vapore"
    ],
    "createdAt": "2026-09-04T09:00:00Z",
    "updatedAt": "2026-09-04T09:00:00Z"
  }
]
