[
  {
    "schemaVersion": 1,
    "termId": "cuisine_indian",
    "taxonomyId": "cuisine",
    "origin": "base",
    "parentTermId": null,
    "i18n": {
      "it": {
        "label": "Indiana",
        "description": ""
      },
      "en": {
        "label": "Indian",
        "description": ""
      }
    },
    "aliases": {
      "it": [],
      "en": []
    },
    "legacyKeys": [
      "indian"
    ],
    "status": "active",
    "supersedesTermId": null,
    "provenance": {
      "sourceType": "system_seed",
      "sourceLabel": "V1 Data/UX Hardening Pass A",
      "reference": null,
      "rationale": "V1 canonical reference-data seed"
    },
    "searchTokens": [
      "cuisine",
      "indian",
      "indiana"
    ],
    "createdAt": "2026-09-04T09:00:00Z",
    "updatedAt": "2026-09-04T09:00:00Z"
  },
  {
    "schemaVersion": 1,
    "termId": "cuisine_chinese",
    "taxonomyId": "cuisine",
    "origin": "base",
    "parentTermId": null,
    "i18n": {
      "it": {
        "label": "Cinese",
        "description": ""
      },
      "en": {
        "label": "Chinese",
        "description": ""
      }
    },
    "aliases": {
      "it": [],
      "en": []
    },
    "legacyKeys": [
      "chinese"
    ],
    "status": "active",
    "supersedesTermId": null,
    "provenance": {
      "sourceType": "system_seed",
      "sourceLabel": "V1 Data/UX Hardening Pass A",
      "reference": null,
      "rationale": "V1 canonical reference-data seed"
    },
    "searchTokens": [
      "cuisine",
      "chinese",
      "cinese"
    ],
    "createdAt": "2026-09-04T09:00:00Z",
    "updatedAt": "2026-09-04T09:00:00Z"
  },
  {
    "schemaVersion": 1,
    "termId": "cuisine_japanese",
    "taxonomyId": "cuisine",
    "origin": "base",
    "parentTermId": null,
    "i18n": {
      "it": {
        "label": "Giapponese",
        "description": ""
      },
      "en": {
        "label": "Japanese",
        "description": ""
      }
    },
    "aliases": {
      "it": [],
      "en": []
    },
    "legacyKeys": [
      "japanese"
    ],
    "status": "active",
    "supersedesTermId": null,
    "provenance": {
      "sourceType": "system_seed",
      "sourceLabel": "V1 Data/UX Hardening Pass A",
      "reference": null,
      "rationale": "V1 canonical reference-data seed"
    },
    "searchTokens": [
      "cuisine",
      "japanese",
      "giapponese"
    ],
    "createdAt": "2026-09-04T09:00:00Z",
    "updatedAt": "2026-09-04T09:00:00Z"
  },
  {
    "schemaVersion": 1,
    "termId": "cuisine_korean",
    "taxonomyId": "cuisine",
    "origin": "base",
    "parentTermId": null,
    "i18n": {
      "it": {
        "label": "Coreana",
        "description": ""
      },
      "en": {
        "label": "Korean",
        "description": ""
      }
    },
    "aliases": {
      "it": [],
      "en": []
    },
    "legacyKeys": [
      "korean"
    ],
    "status": "active",
    "supersedesTermId": null,
    "provenance": {
      "sourceType": "system_seed",
      "sourceLabel": "V1 Data/UX Hardening Pass A",
      "reference": null,
      "rationale": "V1 canonical reference-data seed"
    },
    "searchTokens": [
      "cuisine",
      "korean",
      "coreana"
    ],
    "createdAt": "2026-09-04T09:00:00Z",
    "updatedAt": "2026-09-04T09:00:00Z"
  }
]
