[
  {
    "schemaVersion": 1,
    "termId": "food_subgroup_yogurt",
    "taxonomyId": "food_category",
    "origin": "base",
    "parentTermId": "food_group_dairy_milk_yogurt",
    "i18n": {
      "it": {
        "label": "Yogurt",
        "description": ""
      },
      "en": {
        "label": "Yogurt",
        "description": ""
      }
    },
    "aliases": {
      "it": [],
      "en": []
    },
    "legacyKeys": [
      "yogurt"
    ],
    "status": "active",
    "supersedesTermId": null,
    "provenance": {
      "sourceType": "system_seed",
      "sourceLabel": "V1 Data/UX Hardening Pass A",
      "reference": null,
      "rationale": "V1 canonical reference-data seed"
    },
    "searchTokens": [
      "food",
      "subgroup",
      "yogurt"
    ],
    "createdAt": "2026-09-04T09:00:00Z",
    "updatedAt": "2026-09-04T09:00:00Z"
  },
  {
    "schemaVersion": 1,
    "termId": "cuisine_mediterranean",
    "taxonomyId": "cuisine",
    "origin": "base",
    "parentTermId": null,
    "i18n": {
      "it": {
        "label": "Mediterranea",
        "description": ""
      },
      "en": {
        "label": "Mediterranean",
        "description": ""
      }
    },
    "aliases": {
      "it": [],
      "en": []
    },
    "legacyKeys": [
      "mediterranean"
    ],
    "status": "active",
    "supersedesTermId": null,
    "provenance": {
      "sourceType": "system_seed",
      "sourceLabel": "V1 Data/UX Hardening Pass A",
      "reference": null,
      "rationale": "V1 canonical reference-data seed"
    },
    "searchTokens": [
      "cuisine",
      "mediterranean",
      "mediterranea"
    ],
    "createdAt": "2026-09-04T09:00:00Z",
    "updatedAt": "2026-09-04T09:00:00Z"
  },
  {
    "schemaVersion": 1,
    "termId": "cuisine_italian",
    "taxonomyId": "cuisine",
    "origin": "base",
    "parentTermId": null,
    "i18n": {
      "it": {
        "label": "Italiana",
        "description": ""
      },
      "en": {
        "label": "Italian",
        "description": ""
      }
    },
    "aliases": {
      "it": [],
      "en": []
    },
    "legacyKeys": [
      "italian"
    ],
    "status": "active",
    "supersedesTermId": null,
    "provenance": {
      "sourceType": "system_seed",
      "sourceLabel": "V1 Data/UX Hardening Pass A",
      "reference": null,
      "rationale": "V1 canonical reference-data seed"
    },
    "searchTokens": [
      "cuisine",
      "italian",
      "italiana"
    ],
    "createdAt": "2026-09-04T09:00:00Z",
    "updatedAt": "2026-09-04T09:00:00Z"
  },
  {
    "schemaVersion": 1,
    "termId": "cuisine_french",
    "taxonomyId": "cuisine",
    "origin": "base",
    "parentTermId": null,
    "i18n": {
      "it": {
        "label": "Francese",
        "description": ""
      },
      "en": {
        "label": "French",
        "description": ""
      }
    },
    "aliases": {
      "it": [],
      "en": []
    },
    "legacyKeys": [
      "french"
    ],
    "status": "active",
    "supersedesTermId": null,
    "provenance": {
      "sourceType": "system_seed",
      "sourceLabel": "V1 Data/UX Hardening Pass A",
      "reference": null,
      "rationale": "V1 canonical reference-data seed"
    },
    "searchTokens": [
      "cuisine",
      "french",
      "francese"
    ],
    "createdAt": "2026-09-04T09:00:00Z",
    "updatedAt": "2026-09-04T09:00:00Z"
  }
]
