[
  {
    "schemaVersion": 1,
    "termId": "flavor_spicy",
    "taxonomyId": "flavor_profile",
    "origin": "base",
    "parentTermId": null,
    "i18n": {
      "it": {
        "label": "Piccante",
        "description": ""
      },
      "en": {
        "label": "Spicy",
        "description": ""
      }
    },
    "aliases": {
      "it": [],
      "en": []
    },
    "legacyKeys": [
      "spicy"
    ],
    "status": "active",
    "supersedesTermId": null,
    "provenance": {
      "sourceType": "system_seed",
      "sourceLabel": "V1 Data/UX Hardening Pass A",
      "reference": null,
      "rationale": "V1 canonical reference-data seed"
    },
    "searchTokens": [
      "flavor",
      "spicy",
      "piccante"
    ],
    "createdAt": "2026-09-04T09:00:00Z",
    "updatedAt": "2026-09-04T09:00:00Z"
  },
  {
    "schemaVersion": 1,
    "termId": "flavor_tangy",
    "taxonomyId": "flavor_profile",
    "origin": "base",
    "parentTermId": null,
    "i18n": {
      "it": {
        "label": "Acidulo",
        "description": ""
      },
      "en": {
        "label": "Tangy",
        "description": ""
      }
    },
    "aliases": {
      "it": [],
      "en": []
    },
    "legacyKeys": [
      "tangy"
    ],
    "status": "active",
    "supersedesTermId": null,
    "provenance": {
      "sourceType": "system_seed",
      "sourceLabel": "V1 Data/UX Hardening Pass A",
      "reference": null,
      "rationale": "V1 canonical reference-data seed"
    },
    "searchTokens": [
      "flavor",
      "tangy",
      "acidulo"
    ],
    "createdAt": "2026-09-04T09:00:00Z",
    "updatedAt": "2026-09-04T09:00:00Z"
  },
  {
    "schemaVersion": 1,
    "termId": "flavor_bitter",
    "taxonomyId": "flavor_profile",
    "origin": "base",
    "parentTermId": null,
    "i18n": {
      "it": {
        "label": "Amaro",
        "description": ""
      },
      "en": {
        "label": "Bitter",
        "description": ""
      }
    },
    "aliases": {
      "it": [],
      "en": []
    },
    "legacyKeys": [
      "bitter"
    ],
    "status": "active",
    "supersedesTermId": null,
    "provenance": {
      "sourceType": "system_seed",
      "sourceLabel": "V1 Data/UX Hardening Pass A",
      "reference": null,
      "rationale": "V1 canonical reference-data seed"
    },
    "searchTokens": [
      "flavor",
      "bitter",
      "amaro"
    ],
    "createdAt": "2026-09-04T09:00:00Z",
    "updatedAt": "2026-09-04T09:00:00Z"
  },
  {
    "schemaVersion": 1,
    "termId": "flavor_umami",
    "taxonomyId": "flavor_profile",
    "origin": "base",
    "parentTermId": null,
    "i18n": {
      "it": {
        "label": "Umami",
        "description": ""
      },
      "en": {
        "label": "Umami",
        "description": ""
      }
    },
    "aliases": {
      "it": [],
      "en": []
    },
    "legacyKeys": [
      "umami"
    ],
    "status": "active",
    "supersedesTermId": null,
    "provenance": {
      "sourceType": "system_seed",
      "sourceLabel": "V1 Data/UX Hardening Pass A",
      "reference": null,
      "rationale": "V1 canonical reference-data seed"
    },
    "searchTokens": [
      "flavor",
      "umami"
    ],
    "createdAt": "2026-09-04T09:00:00Z",
    "updatedAt": "2026-09-04T09:00:00Z"
  }
]
