[
  {
    "schemaVersion": 1,
    "termId": "recipe_family_stew",
    "taxonomyId": "recipe_family",
    "origin": "base",
    "parentTermId": null,
    "i18n": {
      "it": {
        "label": "Stufato",
        "description": ""
      },
      "en": {
        "label": "Stew",
        "description": ""
      }
    },
    "aliases": {
      "it": [],
      "en": []
    },
    "legacyKeys": [
      "stew"
    ],
    "status": "active",
    "supersedesTermId": null,
    "provenance": {
      "sourceType": "system_seed",
      "sourceLabel": "V1 Data/UX Hardening Pass A",
      "reference": null,
      "rationale": "V1 canonical reference-data seed"
    },
    "searchTokens": [
      "recipe",
      "family",
      "stew",
      "stufato"
    ],
    "createdAt": "2026-09-04T09:00:00Z",
    "updatedAt": "2026-09-04T09:00:00Z"
  },
  {
    "schemaVersion": 1,
    "termId": "recipe_family_pasta",
    "taxonomyId": "recipe_family",
    "origin": "base",
    "parentTermId": null,
    "i18n": {
      "it": {
        "label": "Pasta",
        "description": ""
      },
      "en": {
        "label": "Pasta",
        "description": ""
      }
    },
    "aliases": {
      "it": [],
      "en": []
    },
    "legacyKeys": [
      "pasta"
    ],
    "status": "active",
    "supersedesTermId": null,
    "provenance": {
      "sourceType": "system_seed",
      "sourceLabel": "V1 Data/UX Hardening Pass A",
      "reference": null,
      "rationale": "V1 canonical reference-data seed"
    },
    "searchTokens": [
      "recipe",
      "family",
      "pasta"
    ],
    "createdAt": "2026-09-04T09:00:00Z",
    "updatedAt": "2026-09-04T09:00:00Z"
  },
  {
    "schemaVersion": 1,
    "termId": "recipe_family_risotto",
    "taxonomyId": "recipe_family",
    "origin": "base",
    "parentTermId": null,
    "i18n": {
      "it": {
        "label": "Risotto",
        "description": ""
      },
      "en": {
        "label": "Risotto",
        "description": ""
      }
    },
    "aliases": {
      "it": [],
      "en": []
    },
    "legacyKeys": [
      "risotto"
    ],
    "status": "active",
    "supersedesTermId": null,
    "provenance": {
      "sourceType": "system_seed",
      "sourceLabel": "V1 Data/UX Hardening Pass A",
      "reference": null,
      "rationale": "V1 canonical reference-data seed"
    },
    "searchTokens": [
      "recipe",
      "family",
      "risotto"
    ],
    "createdAt": "2026-09-04T09:00:00Z",
    "updatedAt": "2026-09-04T09:00:00Z"
  },
  {
    "schemaVersion": 1,
    "termId": "recipe_family_sandwich_wrap",
    "taxonomyId": "recipe_family",
    "origin": "base",
    "parentTermId": null,
    "i18n": {
      "it": {
        "label": "Panino o wrap",
        "description": ""
      },
      "en": {
        "label": "Sandwich or wrap",
        "description": ""
      }
    },
    "aliases": {
      "it": [],
      "en": []
    },
    "legacyKeys": [
      "sandwich_wrap"
    ],
    "status": "active",
    "supersedesTermId": null,
    "provenance": {
      "sourceType": "system_seed",
      "sourceLabel": "V1 Data/UX Hardening Pass A",
      "reference": null,
      "rationale": "V1 canonical reference-data seed"
    },
    "searchTokens": [
      "recipe",
      "family",
      "sandwich",
      "wrap",
      "panino",
      "o",
      "or"
    ],
    "createdAt": "2026-09-04T09:00:00Z",
    "updatedAt": "2026-09-04T09:00:00Z"
  }
]
