[
  {
    "schemaVersion": 1,
    "termId": "food_group_poultry",
    "taxonomyId": "food_category",
    "origin": "base",
    "parentTermId": null,
    "i18n": {
      "it": {
        "label": "Pollame",
        "description": ""
      },
      "en": {
        "label": "Poultry",
        "description": ""
      }
    },
    "aliases": {
      "it": [],
      "en": []
    },
    "legacyKeys": [
      "poultry"
    ],
    "status": "active",
    "supersedesTermId": null,
    "provenance": {
      "sourceType": "system_seed",
      "sourceLabel": "V1 Data/UX Hardening Pass A",
      "reference": null,
      "rationale": "V1 canonical reference-data seed"
    },
    "searchTokens": [
      "food",
      "group",
      "poultry",
      "pollame"
    ],
    "createdAt": "2026-09-04T09:00:00Z",
    "updatedAt": "2026-09-04T09:00:00Z"
  },
  {
    "schemaVersion": 1,
    "termId": "food_group_fish_seafood",
    "taxonomyId": "food_category",
    "origin": "base",
    "parentTermId": null,
    "i18n": {
      "it": {
        "label": "Pesce e frutti di mare",
        "description": ""
      },
      "en": {
        "label": "Fish and seafood",
        "description": ""
      }
    },
    "aliases": {
      "it": [],
      "en": []
    },
    "legacyKeys": [
      "fish_seafood",
      "fish"
    ],
    "status": "active",
    "supersedesTermId": null,
    "provenance": {
      "sourceType": "system_seed",
      "sourceLabel": "V1 Data/UX Hardening Pass A",
      "reference": null,
      "rationale": "V1 canonical reference-data seed"
    },
    "searchTokens": [
      "food",
      "group",
      "fish",
      "seafood",
      "pesce",
      "e",
      "frutti",
      "di",
      "mare",
      "and"
    ],
    "createdAt": "2026-09-04T09:00:00Z",
    "updatedAt": "2026-09-04T09:00:00Z"
  },
  {
    "schemaVersion": 1,
    "termId": "food_group_eggs",
    "taxonomyId": "food_category",
    "origin": "base",
    "parentTermId": null,
    "i18n": {
      "it": {
        "label": "Uova",
        "description": ""
      },
      "en": {
        "label": "Eggs",
        "description": ""
      }
    },
    "aliases": {
      "it": [],
      "en": []
    },
    "legacyKeys": [
      "eggs"
    ],
    "status": "active",
    "supersedesTermId": null,
    "provenance": {
      "sourceType": "system_seed",
      "sourceLabel": "V1 Data/UX Hardening Pass A",
      "reference": null,
      "rationale": "V1 canonical reference-data seed"
    },
    "searchTokens": [
      "food",
      "group",
      "eggs",
      "uova"
    ],
    "createdAt": "2026-09-04T09:00:00Z",
    "updatedAt": "2026-09-04T09:00:00Z"
  },
  {
    "schemaVersion": 1,
    "termId": "food_group_dairy_milk_yogurt",
    "taxonomyId": "food_category",
    "origin": "base",
    "parentTermId": null,
    "i18n": {
      "it": {
        "label": "Latte e yogurt",
        "description": ""
      },
      "en": {
        "label": "Milk and yogurt",
        "description": ""
      }
    },
    "aliases": {
      "it": [],
      "en": []
    },
    "legacyKeys": [
      "dairy",
      "dairy_milk_yogurt"
    ],
    "status": "active",
    "supersedesTermId": null,
    "provenance": {
      "sourceType": "system_seed",
      "sourceLabel": "V1 Data/UX Hardening Pass A",
      "reference": null,
      "rationale": "V1 canonical reference-data seed"
    },
    "searchTokens": [
      "food",
      "group",
      "dairy",
      "milk",
      "yogurt",
      "latte",
      "e",
      "and"
    ],
    "createdAt": "2026-09-04T09:00:00Z",
    "updatedAt": "2026-09-04T09:00:00Z"
  }
]
