[
  {
    "schemaVersion": 1,
    "termId": "recipe_family_baked_dish",
    "taxonomyId": "recipe_family",
    "origin": "base",
    "parentTermId": null,
    "i18n": {
      "it": {
        "label": "Piatto al forno",
        "description": ""
      },
      "en": {
        "label": "Baked dish",
        "description": ""
      }
    },
    "aliases": {
      "it": [],
      "en": []
    },
    "legacyKeys": [
      "baked_dish"
    ],
    "status": "active",
    "supersedesTermId": null,
    "provenance": {
      "sourceType": "system_seed",
      "sourceLabel": "V1 Data/UX Hardening Pass A",
      "reference": null,
      "rationale": "V1 canonical reference-data seed"
    },
    "searchTokens": [
      "recipe",
      "family",
      "baked",
      "dish",
      "piatto",
      "al",
      "forno"
    ],
    "createdAt": "2026-09-04T09:00:00Z",
    "updatedAt": "2026-09-04T09:00:00Z"
  },
  {
    "schemaVersion": 1,
    "termId": "recipe_family_one_pot",
    "taxonomyId": "recipe_family",
    "origin": "base",
    "parentTermId": null,
    "i18n": {
      "it": {
        "label": "Piatto unico in pentola",
        "description": ""
      },
      "en": {
        "label": "One-pot dish",
        "description": ""
      }
    },
    "aliases": {
      "it": [],
      "en": []
    },
    "legacyKeys": [
      "one_pot"
    ],
    "status": "active",
    "supersedesTermId": null,
    "provenance": {
      "sourceType": "system_seed",
      "sourceLabel": "V1 Data/UX Hardening Pass A",
      "reference": null,
      "rationale": "V1 canonical reference-data seed"
    },
    "searchTokens": [
      "recipe",
      "family",
      "one",
      "pot",
      "piatto",
      "unico",
      "in",
      "pentola",
      "dish"
    ],
    "createdAt": "2026-09-04T09:00:00Z",
    "updatedAt": "2026-09-04T09:00:00Z"
  },
  {
    "schemaVersion": 1,
    "termId": "recipe_family_side_dish",
    "taxonomyId": "recipe_family",
    "origin": "base",
    "parentTermId": null,
    "i18n": {
      "it": {
        "label": "Contorno",
        "description": ""
      },
      "en": {
        "label": "Side dish",
        "description": ""
      }
    },
    "aliases": {
      "it": [],
      "en": []
    },
    "legacyKeys": [
      "side_dish"
    ],
    "status": "active",
    "supersedesTermId": null,
    "provenance": {
      "sourceType": "system_seed",
      "sourceLabel": "V1 Data/UX Hardening Pass A",
      "reference": null,
      "rationale": "V1 canonical reference-data seed"
    },
    "searchTokens": [
      "recipe",
      "family",
      "side",
      "dish",
      "contorno"
    ],
    "createdAt": "2026-09-04T09:00:00Z",
    "updatedAt": "2026-09-04T09:00:00Z"
  },
  {
    "schemaVersion": 1,
    "termId": "recipe_family_dessert",
    "taxonomyId": "recipe_family",
    "origin": "base",
    "parentTermId": null,
    "i18n": {
      "it": {
        "label": "Dessert",
        "description": ""
      },
      "en": {
        "label": "Dessert",
        "description": ""
      }
    },
    "aliases": {
      "it": [],
      "en": []
    },
    "legacyKeys": [
      "dessert"
    ],
    "status": "active",
    "supersedesTermId": null,
    "provenance": {
      "sourceType": "system_seed",
      "sourceLabel": "V1 Data/UX Hardening Pass A",
      "reference": null,
      "rationale": "V1 canonical reference-data seed"
    },
    "searchTokens": [
      "recipe",
      "family",
      "dessert"
    ],
    "createdAt": "2026-09-04T09:00:00Z",
    "updatedAt": "2026-09-04T09:00:00Z"
  }
]
